<?xml version="1.0" ?>
<!-- $Id$ --><!DOCTYPE msxconfig
  SYSTEM 'msxconfig.dtd'>
<msxconfig>
  <device id="PanaSoft SW-M001 PAC">
    <type>PAC</type>
    <slotted><ps>-1</ps><ss>-1</ss><page>1</page></slotted>
    <sramname>pac.pac</sramname>
  </device>
</msxconfig>