<?xml version="1.0"?>
<!-- $Id$ -->
<!DOCTYPE msxconfig SYSTEM "msxconfig.dtd">
<msxconfig>

  <info>
    <manufacturer>National</manufacturer>
    <code>FS-5500F1</code>
    <release_year>1985</release_year>
    <description></description>
    <type>MSX2</type>
  </info>

  <config id="ExternalSlots">
    <parameter name="slota">1-0</parameter>
    <parameter name="slotb">2-0</parameter>
  </config>

  <config id="MotherBoard">
    <parameter name="0" class="subslotted">true</parameter>
    <parameter name="1" class="subslotted">false</parameter>
    <parameter name="2" class="subslotted">false</parameter>
    <parameter name="3" class="subslotted">true</parameter>
  </config>

  <device id="Main RAM">
    <type>RAM</type>
    <slotted> <ps>3</ps> <ss>2</ss> <page>0</page> </slotted>
    <slotted> <ps>3</ps> <ss>2</ss> <page>1</page> </slotted>
    <slotted> <ps>3</ps> <ss>2</ss> <page>2</page> </slotted>
    <slotted> <ps>3</ps> <ss>2</ss> <page>3</page> </slotted>
    <parameter name="slow_drain_on_reset">false</parameter>
  </device>

  <device id="MSX BIOS with BASIC ROM">
    <type>Rom</type>
    <slotted> <ps>0</ps> <ss>0</ss> <page>0</page> </slotted>
    <slotted> <ps>0</ps> <ss>0</ss> <page>1</page> </slotted>
    <parameter name="filename">roms/fs-5500_basic-bios2.rom</parameter>
  </device>

  <device id="MSX Sub ROM">
    <type>Rom</type>
    <slotted> <ps>3</ps> <ss>0</ss> <page>0</page> </slotted>
    <parameter name="filename">roms/fs-5500_msx2sub.rom</parameter>
  </device>

  <device id="Super Impose">
    <type>Rom</type>
    <slotted> <ps>3</ps> <ss>1</ss> <page>1</page> </slotted>
    <slotted> <ps>3</ps> <ss>1</ss> <page>2</page> </slotted>
    <parameter name="filename">roms/fs-5500_superimp.rom</parameter>
  </device>

  <device id="MSX Kanji Driver">
    <type>Rom</type>
    <slotted> <ps>3</ps> <ss>0</ss> <page>1</page> </slotted>
    <slotted> <ps>3</ps> <ss>0</ss> <page>2</page> </slotted>
    <parameter name="filename">roms/fs-5500_kanjibasic.rom</parameter>
  </device>

  <device id="Kanji ROM">
    <type>Kanji</type>
    <parameter name="filename">roms/fs-5500_kanjifont.rom</parameter>
  </device>

  <device id="Memory Mapped FDC">
    <type>FDC</type>
    <slotted> <ps>3</ps> <ss>3</ss> <page>1</page> </slotted>
    <slotted> <ps>3</ps> <ss>3</ss> <page>2</page> </slotted>
    <parameter name="filename">roms/fs-5500_disk.rom</parameter>
    <parameter name="type">MB8877A</parameter>
    <parameter name="brokenFDCread">false</parameter>
    <parameter name="drivename1">diska</parameter>
  </device>

  <device id="S1985">
    <type>S1985</type>
  </device>

  <device id="ppi">
    <type>PPI</type>
    <parameter name="volume">16000</parameter>
    <parameter name="key_ghosting">true</parameter>
  </device>

  <device id="VDP">
    <type>VDP</type>
    <parameter name="version">V9938</parameter>
    <parameter name="vram">128</parameter>
  </device>

  <device id="PSG">
    <type>PSG</type>
    <parameter name="volume">21000</parameter>
    <parameter name="keyboardlayout">50on</parameter>
  </device>

  <device id="Real time clock">
    <type>RTC</type>
    <parameter name="mode">EmuTime</parameter>
    <parameter name="sramname">fs-5500f1.cmos</parameter>
  </device>

  <device id="cpu">
    <type>CPU</type>
  </device>

  <device id="Printer Port">
    <type>PrinterPort</type>
  </device>

  <config id="CassettePort">
  </config>

</msxconfig>
