<?xml version="1.0" ?>
<!-- $Id$ --><!DOCTYPE msxconfig
  SYSTEM 'msxconfig.dtd'>
<msxconfig>

  <device id="Sunrise IDE">
    <type>SunriseIDE</type>
    <slotted> <ps>-1</ps> <ss>-1</ss> <page>0</page> </slotted>
    <slotted> <ps>-1</ps> <ss>-1</ss> <page>1</page> </slotted>
    <slotted> <ps>-1</ps> <ss>-1</ss> <page>2</page> </slotted>
    <slotted> <ps>-1</ps> <ss>-1</ss> <page>3</page> </slotted>
    <filename>roms/ide221.dat</filename>
    <master>myHD</master>
  </device>

  <config id="myHD">
    <type>IDEHD</type>
    <filename>hd.dsk</filename>
    <size>100</size>
  </config>

</msxconfig>