<?xml version="1.0"?>
<!-- $Id$ -->
<!DOCTYPE msxconfig SYSTEM "msxconfig.dtd">
<msxconfig>

  <config id="ExternalSlots">
    <parameter name="slota">1-0</parameter>
    <parameter name="slotb">2-0</parameter>
  </config>

  <config id="SearchPaths">
    <parameter class="disk">disks</parameter>
    <parameter class="rom">roms</parameter>
    <parameter class="rom">cfg</parameter>
    <parameter class="tape">tapes</parameter>
    <parameter class="config">cfg</parameter>
    <parameter class="state">cfg</parameter>
  </config>

  <config id="MotherBoard">
    <parameter name="0" class="subslotted">true</parameter>
    <parameter name="1" class="subslotted">false</parameter>
    <parameter name="2" class="subslotted">false</parameter>
    <parameter name="3" class="subslotted">true</parameter>
  </config>

  <device id="MapperIO">
    <type>MapperIO</type>
    <parameter name="type">TurboR</parameter>
  </device>

  <device id="biosrom">
    <type>Rom</type>
    <slotted> <ps>0</ps> <ss>0</ss> <page>0</page> </slotted>
    <parameter name="filename">TurboR-GT-bios.rom</parameter>
  </device>

  <device id="basicrom">
    <type>Rom</type>
    <slotted> <ps>0</ps> <ss>0</ss> <page>1</page> </slotted>
    <parameter name="filename">TurboR-GT-basic.rom</parameter>
  </device>

  <device id="MSX Music">
    <type>Music</type>
    <slotted> <ps>0</ps> <ss>2</ss> <page>1</page> </slotted>
    <parameter name="filename">TurboR-GT-music.rom</parameter>
    <parameter name="volume">9000</parameter>
    <parameter name="mode">mono</parameter>
  </device>
  
  <device id="MSX Opening ROM">
    <type>Rom</type>
    <slotted> <ps>0</ps> <ss>3</ss> <page>1</page> </slotted>
    <parameter name="filename">MSXTROPT.ROM</parameter>
  </device>

  <device id="Main RAM">
    <type>MemoryMapper</type>
    <slotted> <ps>3</ps> <ss>0</ss> <page>0</page> </slotted>
    <slotted> <ps>3</ps> <ss>0</ss> <page>1</page> </slotted>
    <slotted> <ps>3</ps> <ss>0</ss> <page>2</page> </slotted>
    <slotted> <ps>3</ps> <ss>0</ss> <page>3</page> </slotted>
    <parameter name="slow_drain_on_reset">false</parameter>
    <parameter name="size">512</parameter>
  </device>

  <device id="subrom">
    <type>Rom</type>
    <slotted> <ps>3</ps> <ss>1</ss> <page>0</page> </slotted>
    <parameter name="filename">TurboR-GT-sub.rom</parameter>
  </device>
  
  <device id="kanji basic">
    <type>Rom</type>
    <slotted> <ps>3</ps> <ss>1</ss> <page>1</page> </slotted>
    <slotted> <ps>3</ps> <ss>1</ss> <page>2</page> </slotted>
    <parameter name="filename">TurboR-GT-kanji.rom</parameter>
  </device>

  <device id="Memory Mapped FDC">
    <type>FDC</type>
    <slotted> <ps>3</ps> <ss>2</ss> <page>1</page> </slotted>
    <slotted> <ps>3</ps> <ss>2</ss> <page>2</page> </slotted>
    <parameter name="filename">MSXDOS-2.3.rom</parameter>
    <parameter name="type">TurboR</parameter>
    <parameter name="drivename1">diska</parameter>
  </device>

  <device id="MSX VIEW">
    <type>Rom</type>
    <slotted> <ps>3</ps> <ss>3</ss> <page>0</page> </slotted>
    <slotted> <ps>3</ps> <ss>3</ss> <page>1</page> </slotted>
    <slotted> <ps>3</ps> <ss>3</ss> <page>2</page> </slotted>
    <parameter name="filename">TurboR-GT-4MB.rom</parameter>
    <parameter name="mappertype">PANASONIC</parameter>
    <parameter name="loadsram">false</parameter>
    <parameter name="savesram">false</parameter>
  </device>
  
  <device id="ppi">
    <type>PPI</type>
    <parameter name="volume">16000</parameter>
    <parameter name="key_ghosting">true</parameter>
  </device>

  <device id="VDP">
    <type>VDP</type>
    <parameter name="version">V9958</parameter>
    <parameter name="limit_sprites">true</parameter>
    <parameter name="vram">128</parameter>
  </device>

  <config id="renderer">
    <type>SDLGL</type>
    <parameter name="full_screen">false</parameter>
  </config>

  <device id="psg">
    <type>PSG</type>
    <parameter name="volume">21000</parameter>
  </device>

  <device id="Real time clock">
    <type>RTC</type>
    <parameter name="mode">EmuTime</parameter>
    <parameter name="load">true</parameter>
    <parameter name="save">true</parameter>
    <parameter name="filename">RTC.SAVE</parameter>
  </device>

  <config id="RealTime">
    <parameter name="sync_interval">50</parameter>
    <parameter name="max_catch_up_time">2000</parameter>
    <parameter name="max_catch_up_factor">105</parameter>
  </config>

  <device id="cpu">
    <type>CPU</type>
  </device>

  <device id="Printer Port">
    <type>PrinterPort</type>
  </device>
  
  <device id="Turbo-R timer">
    <type>E6Timer</type>
  </device>
  
  <device id="F4Device">
    <type>F4Device</type>
    <parameter name="inverted">false</parameter>
  </device>

  <device id="TurboRLeds">
    <type>TurboRLeds</type>
  </device>

  <device id="TurboRPause">
    <type>TurboRPause</type>
  </device>
  
  <device id="S1990">
    <type>S1990</type>
  </device>
  
  <device id="PCM">
    <type>TurboRPCM</type>
    <parameter name="volume">21000</parameter>
  </device>

  <config id="Mixer">
    <parameter name="frequency">22050</parameter>
    <parameter name="samples">512</parameter>
  </config>

  <config id="Console">
    <parameter name="font">ConsoleFont.png</parameter>
    <parameter name="background">ConsoleBackground2.png</parameter>
  </config>

</msxconfig>

