<?xml version="1.0"?>
<!-- $Id$ -->
<!DOCTYPE msxconfig SYSTEM "msxconfig.dtd">
<msxconfig>
  <device id="Toshiba HX-MU900 MSX-Audio">
    <type>Audio</type>
    <parameter name="volume">12000</parameter>
    <parameter name="mode">mono</parameter>
    <!-- <parameter name="sampleram">32</parameter> -->
  </device>
  
  <device id="Toshiba HX-MU900 firmware">
    <type>Rom</type>
    <slotted> <ps>-1</ps> <ss>-1</ss> <page>1</page> </slotted>
    <slotted> <ps>-1</ps> <ss>-1</ss> <page>2</page> </slotted>
    <parameter name="filename">roms/hx-mu900.rom</parameter>
  </device>
  
</msxconfig>
