<?xml version="1.0" ?>
<!-- $Id$ --><!DOCTYPE msxconfig
  SYSTEM 'msxconfig.dtd'>
<msxconfig>
  <device id="Empty Konami SCC Cartridge">
    <type>ROM</type>
    <slotted> <ps>-1</ps> <ss>-1</ss> <page>1</page> </slotted>
    <slotted> <ps>-1</ps> <ss>-1</ss> <page>2</page> </slotted>
    <volume>11500</volume>
    <mappertype>SCC</mappertype>
  </device>
</msxconfig>